"cultivo","variable","condicion","umbral_min","umbral_max","nivel","icono","titulo","recomendacion","fuente"
"Zanahoria","ph_suelo","muy_bajo","","5.8","advertencia","","Acidez alta: menor calidad y desarrollo de raiz","El suelo esta acido para la zanahoria. Haz analisis de suelo y corrige con cal si corresponde.","FAO Ecocrop - Daucus carota"
"Zanahoria","enfermedad","cualquiera","","","info","","Rotacion y limpieza reducen problemas en hojas","Si ves manchas, pudricion o plantas marchitas en la zanahoria, retira partes muy enfermas y evita mover la enfermedad a plantas sanas.","UMN Extension - Carrot leaf spots"
"Zanahoria","general","cualquiera","","","info","","Mantener humedad uniforme evita deformaciones","Mantén la zanahoria limpio, bien ventilado y revisado. Corrige primero agua, malezas y plantas enfermas.","UMN Extension - Growing carrots and parsnips"
"Coliflor","temperatura","muy_bajo","","10.0","advertencia","","Frio fuerte: crecimiento lento de la pella","El frio puede frenar el crecimiento de la coliflor. Protege plantas pequeñas y evita dejar el suelo demasiado mojado.","FAO Ecocrop - Brassica oleracea var. botrytis"
"Coliflor","temperatura","muy_alto","25.0","","critica","","Calor alto: pella pequena o suelta","Hace mucho calor para la coliflor. Riega temprano, conserva humedad en el suelo y revisa hojas marchitas o quemadas.","FAO Ecocrop - Brassica oleracea var. botrytis"
"Coliflor","precipitacion","muy_bajo","","40.0","advertencia","","Agua insuficiente: baja llenado de pella","Falta lluvia para la coliflor. Riega si puedes y cubre el suelo para conservar humedad.","FAO Ecocrop - Brassica oleracea var. botrytis"
"Coliflor","humedad","muy_alto","80.0","","critica","","Humedad alta: riesgo de manchas en hojas y pudriciones","La humedad alta favorece enfermedades en la coliflor. Revisa hojas y mejora la ventilacion del cultivo.","UMN Extension - Alternaria leaf spot and head rot of Brassica crops"
"Coliflor","ph_suelo","muy_bajo","","6.0","advertencia","","Acidez alta: aumenta riesgo de hernia de la raiz","El suelo esta acido para la coliflor. Haz analisis de suelo y corrige con cal si corresponde.","UMN Extension - Clubroot"
"Coliflor","enfermedad","cualquiera","","","info","","Inspecciona raices y elimina focos con hernia de la raiz","Si ves manchas, pudricion o plantas marchitas en la coliflor, retira partes muy enfermas y evita mover la enfermedad a plantas sanas.","UMN Extension - Clubroot"
"Coliflor","general","cualquiera","","","info","","Buen salida de agua y aireacion mejoran calidad","Mantén la coliflor limpio, bien ventilado y revisado. Corrige primero agua, malezas y plantas enfermas.","FAO Ecocrop - Brassica oleracea var. botrytis"
"Repollo","temperatura","muy_bajo","","12.0","advertencia","","Temperatura baja: cabeza tarda en cerrar","El repollo aguanta clima fresco, pero el frio fuerte retrasa el crecimiento. Protege plantulas recien trasplantadas del viento.","FAO Ecocrop - Brassica oleracea var. capitata"
"Repollo","temperatura","muy_alto","24.0","","advertencia","","Calor alto: cabeza floja y menor calidad","El calor puede dejar cabezas flojas o pequeñas. Riega de forma pareja y evita que el suelo se seque por completo.","FAO Ecocrop - Brassica oleracea var. capitata"
"Repollo","precipitacion","muy_bajo","","40.0","advertencia","","Falta de agua: cabezas pequenas o rajadas","Falta agua para formar cabeza. Riega parejo; no dejes que el suelo pase de muy seco a muy mojado.","FAO Ecocrop - Brassica oleracea var. capitata"
"Repollo","humedad","muy_alto","80.0","","critica","","Humedad alta: pudricion negra y manchas en hojas en aumento","La humedad alta favorece pudricion negra y manchas. Deja ventilacion entre plantas y retira hojas muy enfermas.","UMN Extension - Organic management of black rot / Alternaria in Brassicas"
"Repollo","ph_suelo","muy_bajo","","6.0","advertencia","","Acidez alta: repollo mas expuesto a hernia de la raiz","El suelo acido aumenta el riesgo de raices deformes en repollo. Revisa pH y aplica cal segun analisis antes de sembrar.","UMN Extension - Clubroot"
"Repollo","plaga","cualquiera","","","advertencia","","Monitorea palomilla dorso de diamante y pulgones","Revisa el centro y la parte de abajo de las hojas. Si ves pulgones o gusanos, controla temprano antes de que entren a la cabeza.","UC IPM - Cabbage and cole crops guidance"
"Repollo","general","cualquiera","","","info","","Rotacion y ventilacion reducen problemas sanitarios","No repitas repollo, brocoli, coliflor o rabano en el mismo lote si hubo enfermedad. Rota con cultivos diferentes.","FAO Ecocrop - Brassica oleracea var. capitata / UMN Extension"
"Cebolla","temperatura","muy_bajo","","12.0","advertencia","","Frio: establecimiento lento en cebolla","El frio puede frenar el crecimiento de la cebolla. Protege plantas pequeñas y evita dejar el suelo demasiado mojado.","FAO Ecocrop - Allium cepa"
"Cebolla","temperatura","muy_alto","25.0","","advertencia","","Calor alto: baja calidad de bulbo","Hace mucho calor para la cebolla. Riega temprano, conserva humedad en el suelo y revisa hojas marchitas o quemadas.","FAO Ecocrop - Allium cepa"
"Cebolla","precipitacion","muy_bajo","","25.0","advertencia","","Falta de agua: bulbo pequeno y crecimiento irregular","Falta lluvia para la cebolla. Riega si puedes y cubre el suelo para conservar humedad.","FAO Ecocrop - Allium cepa"
"Cebolla","humedad","muy_alto","80.0","","critica","","Humedad alta: mildiu y mancha en hojas en avance","La humedad alta favorece enfermedades en la cebolla. Revisa hojas y mejora la ventilacion del cultivo.","Cornell / UC IPM - Onion disease guidance"
"Cebolla","ph_suelo","muy_bajo","","6.0","advertencia","","Acidez alta: menor desarrollo de bulbo","El suelo esta acido para la cebolla. Haz analisis de suelo y corrige con cal si corresponde.","FAO Ecocrop - Allium cepa"
"Cebolla","plaga","cualquiera","","","advertencia","","Revisa trips en hojas nuevas y puntas plateadas","Revisa la cebolla con frecuencia. Si ves insectos, huevos o daño nuevo, actua temprano y usa solo productos autorizados.","UC IPM - Onion/Garlic thrips"
"Cebolla","general","cualquiera","","","info","","Evita mojado en hojas prolongado y mejora curado","Mantén la cebolla limpio, bien ventilado y revisado. Corrige primero agua, malezas y plantas enfermas.","FAO Ecocrop - Allium cepa / Cornell onion guidance"
"Limon","temperatura","muy_bajo","","15.0","advertencia","","Frio: dano en brotes y floracion de limon","El frio puede frenar el crecimiento de el limon. Protege plantas pequeñas y evita dejar el suelo demasiado mojado.","FAO Ecocrop - Citrus limon"
"Limon","temperatura","muy_alto","28.0","","advertencia","","Calor alto: estres y caida de fruto joven","Hace mucho calor para el limon. Riega temprano, conserva humedad en el suelo y revisa hojas marchitas o quemadas.","FAO Ecocrop - Citrus limon"
"Limon","precipitacion","muy_bajo","","35.0","advertencia","","Agua insuficiente: fruto pequeno y caida prematura","Falta lluvia para el limon. Riega si puedes y cubre el suelo para conservar humedad.","FAO Ecocrop - Citrus limon"
"Limon","precipitacion","alto","90.0","","critica","","Exceso de agua: riesgo de Phytophthora en raices","Hay demasiada lluvia para el limon. Limpia salidas de agua y revisa si aparecen pudriciones o manchas.","UC IPM - Phytophthora gummosis of citrus"
"Limon","ph_suelo","alto","7.5","","advertencia","","PH alto: hojas amarillas por hierro y zinc","El pH esta alto para el limon. Revisa hojas amarillas y ajusta la fertilizacion con base en analisis de suelo.","FAO Ecocrop - Citrus limon / UC IPM citrus disorders"
"Limon","plaga","cualquiera","","","advertencia","","Monitorea minador de los citricos en brotes tiernos","Revisa el limon con frecuencia. Si ves insectos, huevos o daño nuevo, actua temprano y usa solo productos autorizados.","UC IPM - Citrus leafminer"
"Limon","general","cualquiera","","","info","","Mantiene salida de agua, cobertura seca y tronco libre de humedad","Mantén el limon limpio, bien ventilado y revisado. Corrige primero agua, malezas y plantas enfermas.","FAO Ecocrop - Citrus limon / UC IPM"
"Maiz","general","cualquiera","","","info","","Siembra uniforme para bajar presion de gusano cogollero","Siembra lo mas parejo posible dentro del lote. Cuando hay maiz de muchas edades, el gusano cogollero encuentra alimento por mas tiempo.","https://repository.cimmyt.org/items/ff2b5489-1d88-4b96-94a0-143ca7af3f77"
"Maiz","plaga","cualquiera","","","advertencia","","Muestreo semanal de gusano cogollero","Revisa el cogollo del maiz. Si ves agujeros, polvo oscuro o gusanos pequeños, controla temprano antes de que el daño avance.","https://www.cimmyt.org/projects/fall-armyworm-r4d-and-management/"
"Maiz","precipitacion","muy_bajo","","45.0","critica","","Prioriza riego en floracion","Falta lluvia. Si el maiz esta floreando o llenando grano, da prioridad al riego y conserva humedad con cobertura seca.","https://www.fao.org/3/s2022e/s2022e07.htm"
"Maiz","precipitacion","muy_alto","120.0","","advertencia","","Salida de agua despues de lluvia fuerte","Hay demasiada lluvia. Limpia zanjas y salidas de agua para que las raices no queden ahogadas.","https://www.icta.gob.gt/publicaciones/Maiz/cultivoMaizManejoAgronomico.pdf"
"Maiz","temperatura","muy_alto","34.0","","critica","","Calor extremo durante polinizacion","Hace mucho calor para el maiz. Riega temprano, revisa si las hojas se enrollan y cuida la floracion porque ahi se pierde rendimiento.","https://www.cimmyt.org/blogs/heat-tolerant-maize-a-solution-for-climate-change-induced-360-water-deficits/"
"Maiz","humedad","muy_alto","85.0","","advertencia","","Vigilar mancha de asfalto y tizones","La humedad alta puede traer manchas en hojas y enfermedades. Revisa hojas medias y bajas, y evita que el cultivo quede demasiado cerrado.","https://www.icta.gob.gt/publicacionesdemaiz"
"Maiz","ph_suelo","muy_bajo","","5.8","advertencia","","Corregir acidez antes de fertilizar fuerte","El suelo acido hace que el maiz aproveche menos los nutrientes. Haz analisis de suelo y planifica aplicar cal antes del siguiente ciclo.","https://www.icta.gob.gt/publicaciones/Maiz/Recomendaciones%20tecnicas%20de%20maiz%20ICTA.pdf"
"Maiz","general","cualquiera","","","info","","Fertilizacion fraccionada","No pongas todo el fertilizante de una vez. Guarda una parte para cuando la planta este fuerte y haya humedad en el suelo.","https://www.icta.gob.gt/publicaciones/Maiz/cultivoMaizManejoAgronomico.pdf"
"Maiz","general","cualquiera","","","info","","Control temprano de malezas","Mantén el maiz libre de malezas durante las primeras semanas. La primera limpia temprana ayuda mucho al rendimiento.","https://www.icta.gob.gt/publicaciones/Maiz/cultivoMaizManejoAgronomico.pdf"
"Maiz","general","cualquiera","","","info","","Secado seguro para almacenamiento","Antes de guardar maiz, seca bien la mazorca o el grano. No uses costales humedos porque aparecen hongos y gorgojos.","https://www.icta.gob.gt/publicaciones/Maiz/cultivoMaizManejoAgronomico.pdf"
"Frijol","plaga","cualquiera","","","advertencia","","Revision temprana de mosca blanca","Revisa la parte de abajo de las hojas. Si ves mosca blanca, trips, pulgones o daño nuevo, controla malezas y actua temprano.","https://www.gob.mx/inifap/articulos/tecnologia-para-el-manejo-integrado-de-insectos-plaga-del-frijol"
"Frijol","plaga","cualquiera","","","advertencia","","Chicharrita y trips en clima seco","Revisa la parte de abajo de las hojas. Si ves mosca blanca, trips, pulgones o daño nuevo, controla malezas y actua temprano.","https://www.gob.mx/inifap/articulos/tecnologia-para-el-manejo-integrado-de-insectos-plaga-del-frijol"
"Frijol","enfermedad","cualquiera","","","critica","","Manchas negras en hojas y vainas","Si ves manchas oscuras en hojas, tallos o vainas, no guardes semilla de esas plantas. Retira residuos enfermos y evita trabajar con hojas mojadas.","https://ipm.cahnr.uconn.edu/anthracnose-of-bean/"
"Frijol","humedad","muy_alto","82.0","","critica","","Enfermedad por bacteria despues de lluvia con viento","La humedad alta favorece roya y manchas negras. Revisa la parte de abajo de las hojas y no entres al cultivo cuando este mojado.","https://extension.illinois.edu/plant-problems/bacterial-diseases-beans"
"Frijol","precipitacion","muy_bajo","","35.0","critica","","Riego en floracion y llenado de vaina","Falta agua para el frijol. Riega moderado, sobre todo en floracion y llenado de vaina, sin encharcar.","https://www.fao.org/3/s2022e/s2022e07.htm"
"Frijol","precipitacion","muy_alto","80.0","","advertencia","","Evitar agua estancada en frijol","Demasiada lluvia aumenta pudriciones en frijol. Abre salidas de agua y evita entrar al lote cuando este mojado.","https://www.fao.org/4/T0551E/t0551e07.htm"
"Frijol","temperatura","muy_bajo","","16.0","advertencia","","Frio retrasa crecimiento del frijol","Con frio el frijol crece lento. Mantén el lote limpio de malezas y evita exceso de agua hasta que suba la temperatura.","https://www.icta.gob.gt/publicaciones/Frijol/Manual%20de%20producci%C3%B3n%20de%20frijol%20ICTA.pdf"
"Frijol","ph_suelo","muy_bajo","","5.8","advertencia","","Acidez baja nodulacion","El suelo acido debilita al frijol y reduce las bacterias buenas de la raiz. Haz analisis y corrige con cal si corresponde.","https://www.icta.gob.gt/publicaciones/Frijol/Manual%20de%20producci%C3%B3n%20de%20frijol%20ICTA.pdf"
"Frijol","general","cualquiera","","","info","","Usar semilla sana y no mezclar semilla enferma","Usa semilla sana, sin manchas ni deformaciones. No mezcles semilla de plantas enfermas con semilla buena.","https://www.umass.edu/agriculture-food-environment/vegetable/fact-sheets/bean-anthracnose"
"Frijol","general","cualquiera","","","info","","Rotacion para bajar enfermedades","No siembres frijol siempre en el mismo lugar. Rota con maiz u otro cultivo diferente para bajar enfermedades.","https://ipm.cahnr.uconn.edu/anthracnose-of-bean/"
"Repollo","enfermedad","cualquiera","","","critica","","Raices deformes en repollo","Si ves hojas con manchas, venas oscuras o plantas marchitas, separa las plantas mas afectadas y limpia herramientas antes de pasar a otro lote.","https://extension.umn.edu/plant-diseases/clubroot"
"Repollo","ph_suelo","muy_bajo","","6.2","advertencia","","Subir pH para reducir hernia","El suelo acido aumenta el riesgo de raices deformes en repollo. Revisa pH y aplica cal segun analisis antes de sembrar.","https://www.vegetables.cornell.edu/pest-management/disease-factsheets/clubroot-of-crucifers/"
"Repollo","humedad","muy_alto","85.0","","critica","","Riesgo de pudricion negra","La humedad alta favorece pudricion negra y manchas. Deja ventilacion entre plantas y retira hojas muy enfermas.","https://extension.umn.edu/disease-management/organic-management-black-rot"
"Repollo","precipitacion","muy_alto","90.0","","advertencia","","Evitar salpique y hojas mojadas","Mucha lluvia favorece manchas y pudriciones. Mejora la salida de agua y evita mojar las hojas al final del dia.","https://extension.uga.edu/publications/detail.cfm?number=B1181"
"Repollo","precipitacion","muy_bajo","","35.0","advertencia","","Riego parejo durante formacion de cabeza","Falta agua para formar cabeza. Riega parejo; no dejes que el suelo pase de muy seco a muy mojado.","https://www.fao.org/3/s2022e/s2022e07.htm"
"Repollo","plaga","cualquiera","","","advertencia","","Pulgones dentro de la cabeza","Revisa el centro y la parte de abajo de las hojas. Si ves pulgones o gusanos, controla temprano antes de que entren a la cabeza.","https://extension.uga.edu/publications/detail.cfm?number=B1181"
"Repollo","plaga","cualquiera","","","advertencia","","Gusanos masticadores en hojas","Revisa el centro y la parte de abajo de las hojas. Si ves pulgones o gusanos, controla temprano antes de que entren a la cabeza.","https://extension.umn.edu/vegetables/growing-cabbage"
"Repollo","general","cualquiera","","","info","","Usar plantulas sanas","Trasplanta solo plantulas sanas. Evita plantas con raices torcidas, hojas amarillas o manchas.","https://www.vegetables.cornell.edu/pest-management/disease-factsheets/clubroot-of-crucifers/"
"Repollo","general","cualquiera","","","info","","Rotar con cultivos diferentes","No repitas repollo, brocoli, coliflor o rabano en el mismo lote si hubo enfermedad. Rota con cultivos diferentes.","https://ecommons.cornell.edu/bitstream/handle/1813/42703/kraut-cabbage-elements-NYSIPM.pdf"
"Repollo","temperatura","muy_alto","30.0","","advertencia","","Calor durante formacion de cabeza","El calor puede dejar cabezas flojas o pequeñas. Riega de forma pareja y evita que el suelo se seque por completo.","https://extension.uga.edu/publications/detail.cfm?number=B1181"
"Repollo","temperatura","muy_bajo","","8.0","advertencia","","Frio y estres en plantulas","El repollo aguanta clima fresco, pero el frio fuerte retrasa el crecimiento. Protege plantulas recien trasplantadas del viento.","https://extension.umn.edu/vegetables/growing-cabbage"
"Repollo","general","cualquiera","","","info","","Eliminar residuos enfermos","Despues de cosechar, retira hojas y tallos enfermos. Asi reduces enfermedades para la siguiente siembra.","https://extension.umn.edu/disease-management/organic-management-black-rot"
