"cultivo","variable","condicion","umbral_min","umbral_max","nivel","icono","titulo","recomendacion","fuente"
"Papa","general","cualquiera","","","info","","Suelo suelto y drenado ayuda a que aparezca tubérculos","Mantén la papa limpio, bien ventilado y revisado. Corrige primero agua, malezas y plantas enfermas.","https://ecocrop.apps.fao.org/ecocrop/srv/en/dataSheet?id=1971 | https://www.fao.org/land-water/databases-and-software/crop-information/potato/en/"
"Tomate","temperatura","muy_bajo","","18.0","advertencia","","Temperatura baja: el tomate se enlentece","El frio puede frenar el crecimiento de el tomate. Protege plantas pequeñas y evita dejar el suelo demasiado mojado.","https://www.fao.org/land-water/databases-and-software/crop-information/tomato/en/ | https://ecocrop.apps.fao.org/ecocrop/srv/en/cropView?id=9825"
"Tomate","temperatura","muy_alto","25.0","","advertencia","","Calor: floracion y cuajado se vuelven inestables","Hace mucho calor para el tomate. Riega temprano, conserva humedad en el suelo y revisa hojas marchitas o quemadas.","https://www.fao.org/land-water/databases-and-software/crop-information/tomato/en/ | https://ecocrop.apps.fao.org/ecocrop/srv/en/cropView?id=9825"
"Tomate","precipitacion","muy_bajo","","1200.0","advertencia","","Lluvia baja: aumenta dependencia del riego","Falta lluvia para el tomate. Riega si puedes y cubre el suelo para conservar humedad.","https://www.fao.org/land-water/databases-and-software/crop-information/tomato/en/ | https://ecocrop.apps.fao.org/ecocrop/srv/en/cropView?id=9825"
"Tomate","precipitacion","muy_alto","1600.0","","advertencia","","Lluvia alta: más problemas de rajado y enfermedad","Hay demasiada lluvia para el tomate. Limpia salidas de agua y revisa si aparecen pudriciones o manchas.","https://www.fao.org/land-water/databases-and-software/crop-information/tomato/en/ | https://ecocrop.apps.fao.org/ecocrop/srv/en/cropView?id=9825"
"Tomate","ph_suelo","muy_bajo","","5.0","advertencia","","Acidez alta: tomate sale del rango preferido","El suelo esta acido para el tomate. Haz analisis de suelo y corrige con cal si corresponde.","https://www.fao.org/land-water/databases-and-software/crop-information/tomato/en/ | https://ecocrop.apps.fao.org/ecocrop/srv/en/cropView?id=9825"
"Tomate","ph_suelo","alto","7.0","","advertencia","","PH alcalino: vigila hojas amarillas y rendimiento","El pH esta alto para el tomate. Revisa hojas amarillas y ajusta la fertilizacion con base en analisis de suelo.","https://www.fao.org/land-water/databases-and-software/crop-information/tomato/en/ | https://ecocrop.apps.fao.org/ecocrop/srv/en/cropView?id=9825"
"Tomate","general","cualquiera","","","info","","Evita el agua estancada en tomate","Mantén el tomate limpio, bien ventilado y revisado. Corrige primero agua, malezas y plantas enfermas.","https://www.fao.org/land-water/databases-and-software/crop-information/tomato/en/ | https://ecocrop.apps.fao.org/ecocrop/srv/en/cropView?id=9825"
"Tomate","general","cualquiera","","","info","","En trópico suele rendir mejor en altura media","Mantén el tomate limpio, bien ventilado y revisado. Corrige primero agua, malezas y plantas enfermas.","https://www.fao.org/land-water/databases-and-software/crop-information/tomato/en/ | https://ecocrop.apps.fao.org/ecocrop/srv/en/cropView?id=9825"
"Aguacate","temperatura","muy_bajo","","15.0","advertencia","","Frío: crecimiento lento y más riesgo de daño","El frio puede frenar el crecimiento de el aguacate. Protege plantas pequeñas y evita dejar el suelo demasiado mojado.","https://ecocrop.apps.fao.org/ecocrop/srv/en/dataSheet?id=17645 | https://ecocrop.apps.fao.org/ecocrop/srv/en/dataSheet?id=17646"
"Aguacate","temperatura","muy_alto","26.0","","advertencia","","Temperatura alta: mayor demanda de agua","Hace mucho calor para el aguacate. Riega temprano, conserva humedad en el suelo y revisa hojas marchitas o quemadas.","https://ecocrop.apps.fao.org/ecocrop/srv/en/dataSheet?id=17645 | https://ecocrop.apps.fao.org/ecocrop/srv/en/dataSheet?id=17646"
"Aguacate","precipitacion","muy_bajo","","1000.0","advertencia","","Lluvia insuficiente para aguacate","Falta lluvia para el aguacate. Riega si puedes y cubre el suelo para conservar humedad.","https://ecocrop.apps.fao.org/ecocrop/srv/en/dataSheet?id=17645 | https://ecocrop.apps.fao.org/ecocrop/srv/en/dataSheet?id=17646"
"Aguacate","precipitacion","muy_alto","1400.0","","advertencia","","Exceso de lluvia: vigila asfixia en raices","Hay demasiada lluvia para el aguacate. Limpia salidas de agua y revisa si aparecen pudriciones o manchas.","https://ecocrop.apps.fao.org/ecocrop/srv/en/dataSheet?id=17645 | https://ecocrop.apps.fao.org/ecocrop/srv/en/dataSheet?id=17646"
"Aguacate","ph_suelo","muy_bajo","","5.0","advertencia","","PH muy ácido para aguacate","El suelo esta acido para el aguacate. Haz analisis de suelo y corrige con cal si corresponde.","https://ecocrop.apps.fao.org/ecocrop/srv/en/dataSheet?id=17645 | https://ecocrop.apps.fao.org/ecocrop/srv/en/dataSheet?id=17646"
"Aguacate","ph_suelo","alto","7.0","","advertencia","","PH alto: posible desbalance nutricional","El pH esta alto para el aguacate. Revisa hojas amarillas y ajusta la fertilizacion con base en analisis de suelo.","https://ecocrop.apps.fao.org/ecocrop/srv/en/dataSheet?id=17645 | https://ecocrop.apps.fao.org/ecocrop/srv/en/dataSheet?id=17646"
"Aguacate","general","cualquiera","","","info","","Aguacate necesita salida de agua excelente","Mantén el aguacate limpio, bien ventilado y revisado. Corrige primero agua, malezas y plantas enfermas.","https://ecocrop.apps.fao.org/ecocrop/srv/en/dataSheet?id=17645 | https://ecocrop.apps.fao.org/ecocrop/srv/en/dataSheet?id=17646"
"Aguacate","general","cualquiera","","","info","","La raza guatemalteca tolera mejor altitud media-alta","Mantén el aguacate limpio, bien ventilado y revisado. Corrige primero agua, malezas y plantas enfermas.","https://ecocrop.apps.fao.org/ecocrop/srv/en/dataSheet?id=17645 | https://ecocrop.apps.fao.org/ecocrop/srv/en/dataSheet?id=17646"
"Banano","temperatura","muy_bajo","","22.0","advertencia","","Temperatura fresca: se frena el banano","El frio puede frenar el crecimiento de el banano. Protege plantas pequeñas y evita dejar el suelo demasiado mojado.","https://ecocrop.apps.fao.org/ecocrop/srv/en/dataSheet?id=2483 | https://www.fao.org/land-water/databases-and-software/crop-information/banana/en/"
"Banano","temperatura","muy_alto","32.0","","advertencia","","Calor fuerte: sube la demanda de agua","Hace mucho calor para el banano. Riega temprano, conserva humedad en el suelo y revisa hojas marchitas o quemadas.","https://ecocrop.apps.fao.org/ecocrop/srv/en/dataSheet?id=2483 | https://www.fao.org/land-water/databases-and-software/crop-information/banana/en/"
"Banano","precipitacion","muy_bajo","","2000.0","advertencia","","Lluvia baja para banano","Falta lluvia para el banano. Riega si puedes y cubre el suelo para conservar humedad.","https://ecocrop.apps.fao.org/ecocrop/srv/en/dataSheet?id=2483 | https://www.fao.org/land-water/databases-and-software/crop-information/banana/en/"
"Banano","precipitacion","muy_alto","2700.0","","advertencia","","Lluvia muy alta: más riesgo sanitario","Hay demasiada lluvia para el banano. Limpia salidas de agua y revisa si aparecen pudriciones o manchas.","https://ecocrop.apps.fao.org/ecocrop/srv/en/dataSheet?id=2483 | https://www.fao.org/land-water/databases-and-software/crop-information/banana/en/"
"Banano","ph_suelo","muy_bajo","","5.0","advertencia","","Acidez alta en suelo bananero","El suelo esta acido para el banano. Haz analisis de suelo y corrige con cal si corresponde.","https://ecocrop.apps.fao.org/ecocrop/srv/en/dataSheet?id=2483 | https://www.fao.org/land-water/databases-and-software/crop-information/banana/en/"
"Banano","ph_suelo","alto","7.0","","advertencia","","Suelo alcalino: vigila absorción de nutrientes","El pH esta alto para el banano. Revisa hojas amarillas y ajusta la fertilizacion con base en analisis de suelo.","https://ecocrop.apps.fao.org/ecocrop/srv/en/dataSheet?id=2483 | https://www.fao.org/land-water/databases-and-software/crop-information/banana/en/"
"Banano","general","cualquiera","","","info","","Banano es sensible a viento y sequía","Mantén el banano limpio, bien ventilado y revisado. Corrige primero agua, malezas y plantas enfermas.","https://ecocrop.apps.fao.org/ecocrop/srv/en/dataSheet?id=2483 | https://www.fao.org/land-water/databases-and-software/crop-information/banana/en/"
"Banano","general","cualquiera","","","info","","Salida de agua y abono organico son claves","Mantén el banano limpio, bien ventilado y revisado. Corrige primero agua, malezas y plantas enfermas.","https://ecocrop.apps.fao.org/ecocrop/srv/en/dataSheet?id=2483 | https://www.fao.org/land-water/databases-and-software/crop-information/banana/en/"
"Sorgo","temperatura","muy_bajo","","22.0","advertencia","","Temperatura baja para sorgo","El frio puede frenar el crecimiento de el sorgo. Protege plantas pequeñas y evita dejar el suelo demasiado mojado.","https://ecocrop.apps.fao.org/ecocrop/srv/en/dataSheet?id=48747 | https://www.fao.org/land-water/databases-and-software/crop-information/sorghum/en/"
"Sorgo","temperatura","muy_alto","35.0","","advertencia","","Calor extremo: vigila humedad del perfil","Hace mucho calor para el sorgo. Riega temprano, conserva humedad en el suelo y revisa hojas marchitas o quemadas.","https://ecocrop.apps.fao.org/ecocrop/srv/en/dataSheet?id=48747 | https://www.fao.org/land-water/databases-and-software/crop-information/sorghum/en/"
"Sorgo","precipitacion","muy_bajo","","400.0","advertencia","","Lluvia muy baja incluso para sorgo","Falta lluvia para el sorgo. Riega si puedes y cubre el suelo para conservar humedad.","https://ecocrop.apps.fao.org/ecocrop/srv/en/dataSheet?id=48747 | https://www.fao.org/land-water/databases-and-software/crop-information/sorghum/en/"
"Sorgo","precipitacion","muy_alto","600.0","","advertencia","","Lluvia alta: revisa sanidad y salida de agua","Hay demasiada lluvia para el sorgo. Limpia salidas de agua y revisa si aparecen pudriciones o manchas.","https://ecocrop.apps.fao.org/ecocrop/srv/en/dataSheet?id=48747 | https://www.fao.org/land-water/databases-and-software/crop-information/sorghum/en/"
"Sorgo","ph_suelo","muy_bajo","","5.5","advertencia","","Acidez fuera del óptimo del sorgo","El suelo esta acido para el sorgo. Haz analisis de suelo y corrige con cal si corresponde.","https://ecocrop.apps.fao.org/ecocrop/srv/en/dataSheet?id=48747 | https://www.fao.org/land-water/databases-and-software/crop-information/sorghum/en/"
"Sorgo","ph_suelo","alto","7.5","","advertencia","","PH alto en sorgo","El pH esta alto para el sorgo. Revisa hojas amarillas y ajusta la fertilizacion con base en analisis de suelo.","https://ecocrop.apps.fao.org/ecocrop/srv/en/dataSheet?id=48747 | https://www.fao.org/land-water/databases-and-software/crop-information/sorghum/en/"
"Sorgo","general","cualquiera","","","info","","Cultivo apto para ambientes secos","Mantén el sorgo limpio, bien ventilado y revisado. Corrige primero agua, malezas y plantas enfermas.","https://ecocrop.apps.fao.org/ecocrop/srv/en/dataSheet?id=48747 | https://www.fao.org/land-water/databases-and-software/crop-information/sorghum/en/"
"Sorgo","general","cualquiera","","","info","","Prefiere buen salida de agua aun en secano","Mantén el sorgo limpio, bien ventilado y revisado. Corrige primero agua, malezas y plantas enfermas.","https://ecocrop.apps.fao.org/ecocrop/srv/en/dataSheet?id=48747 | https://www.fao.org/land-water/databases-and-software/crop-information/sorghum/en/"
"Soya","temperatura","muy_bajo","","20.0","advertencia","","Temperatura baja: soya arranca lento","El frio puede frenar el crecimiento de la soya. Protege plantas pequeñas y evita dejar el suelo demasiado mojado.","https://ecocrop.apps.fao.org/ecocrop/srv/en/dataSheet?id=1150 | https://www.fao.org/land-water/databases-and-software/crop-information/soybean/en/"
"Soya","temperatura","muy_alto","33.0","","advertencia","","Calor alto: aumenta el estrés de la soya","Hace mucho calor para la soya. Riega temprano, conserva humedad en el suelo y revisa hojas marchitas o quemadas.","https://ecocrop.apps.fao.org/ecocrop/srv/en/dataSheet?id=1150 | https://www.fao.org/land-water/databases-and-software/crop-information/soybean/en/"
"Soya","precipitacion","muy_bajo","","600.0","advertencia","","Lluvia baja: soya puede requerir apoyo","Falta lluvia para la soya. Riega si puedes y cubre el suelo para conservar humedad.","https://ecocrop.apps.fao.org/ecocrop/srv/en/dataSheet?id=1150 | https://www.fao.org/land-water/databases-and-software/crop-information/soybean/en/"
"Soya","precipitacion","muy_alto","1500.0","","advertencia","","Lluvia excesiva: vigila aireación en raices","Hay demasiada lluvia para la soya. Limpia salidas de agua y revisa si aparecen pudriciones o manchas.","https://ecocrop.apps.fao.org/ecocrop/srv/en/dataSheet?id=1150 | https://www.fao.org/land-water/databases-and-software/crop-information/soybean/en/"
"Soya","ph_suelo","muy_bajo","","5.5","advertencia","","Acidez limita el ambiente óptimo de la soya","El suelo esta acido para la soya. Haz analisis de suelo y corrige con cal si corresponde.","https://ecocrop.apps.fao.org/ecocrop/srv/en/dataSheet?id=1150 | https://www.fao.org/land-water/databases-and-software/crop-information/soybean/en/"
"Soya","ph_suelo","alto","6.5","","advertencia","","PH alto: fuera del óptimo de la soya","El pH esta alto para la soya. Revisa hojas amarillas y ajusta la fertilizacion con base en analisis de suelo.","https://ecocrop.apps.fao.org/ecocrop/srv/en/dataSheet?id=1150 | https://www.fao.org/land-water/databases-and-software/crop-information/soybean/en/"
"Soya","general","cualquiera","","","info","","La inoculación ayuda a aprovechar nitrogeno","Mantén la soya limpio, bien ventilado y revisado. Corrige primero agua, malezas y plantas enfermas.","https://ecocrop.apps.fao.org/ecocrop/srv/en/dataSheet?id=1150 | https://www.fao.org/land-water/databases-and-software/crop-information/soybean/en/"
"Soya","general","cualquiera","","","info","","Soya necesita buena luz y humedad estable","Mantén la soya limpio, bien ventilado y revisado. Corrige primero agua, malezas y plantas enfermas.","https://ecocrop.apps.fao.org/ecocrop/srv/en/dataSheet?id=1150 | https://www.fao.org/land-water/databases-and-software/crop-information/soybean/en/"
"Cafe","temperatura","muy_bajo","","18.0","advertencia","","Ambiente fresco para café arábica","El frio puede frenar el crecimiento de el cafe. Protege plantas pequeñas y evita dejar el suelo demasiado mojado.","https://worldcoffeeresearch.org/news/2018/coping-with-32 | https://www.aboutcoffee.org/origins/coffee-regions-of-the-world/"
"Cafe","temperatura","muy_alto","24.0","","advertencia","","Calor sostenido baja aptitud del café","Hace mucho calor para el cafe. Riega temprano, conserva humedad en el suelo y revisa hojas marchitas o quemadas.","https://worldcoffeeresearch.org/news/2018/coping-with-32 | https://www.aboutcoffee.org/origins/coffee-regions-of-the-world/"
"Cafe","altitud","muy_bajo","","975.0","advertencia","","Altitud baja: más presión de calor en arábica","Revisa el cafe esta semana. Si notas hojas dañadas, marchitez o crecimiento lento, corrige agua, malezas y nutricion antes de que el problema avance.","https://worldcoffeeresearch.org/news/2018/coping-with-32 | https://www.aboutcoffee.org/origins/coffee-regions-of-the-world/"
"Cafe","general","cualquiera","","","info","","Sombra bien manejada ayuda a amortiguar estrés","Mantén el cafe limpio, bien ventilado y revisado. Corrige primero agua, malezas y plantas enfermas.","https://worldcoffeeresearch.org/news/2018/coping-with-32 | https://www.aboutcoffee.org/origins/coffee-regions-of-the-world/"
"Banano","humedad","muy_alto","85.0","","critica","","Sigatoka negra: condiciones muy favorables","La humedad alta favorece enfermedades en el banano. Revisa hojas y mejora la ventilacion del cultivo.","FAO - Black Sigatoka management"
"Banano","precipitacion","alto","2400.0","","advertencia","","Lluvias persistentes: refuerza salida de agua en banano","Hay demasiada lluvia para el banano. Limpia salidas de agua y revisa si aparecen pudriciones o manchas.","FAO Crop Information | FAO Black Sigatoka"
"Banano","temperatura","alto","30.0","","advertencia","","Temperatura alta: aumenta demanda hidrica","Hace mucho calor para el banano. Riega temprano, conserva humedad en el suelo y revisa hojas marchitas o quemadas.","FAO Crop Information - Banana"
"Banano","general","cualquiera","","","info","","Deshoje sanitario y ventilacion del lote","Mantén el banano limpio, bien ventilado y revisado. Corrige primero agua, malezas y plantas enfermas.","FAO - Integrated management of Black Sigatoka"
"Sorgo","temperatura","alto","32.0","","info","","Calor alto: el sorgo resiste, pero vigila floracion","Hace mucho calor para el sorgo. Riega temprano, conserva humedad en el suelo y revisa hojas marchitas o quemadas.","FAO Crop Information - Sorghum | ICRISAT"
"Sorgo","plaga","cualquiera","","","advertencia","","Monitorea mosca del brote y barrenadores","Revisa el sorgo con frecuencia. Si ves insectos, huevos o daño nuevo, actua temprano y usa solo productos autorizados.","ICRISAT Sorghum overview"
"Sorgo","general","cualquiera","","","info","","El sorgo responde bien a riego suplementario en secano","Mantén el sorgo limpio, bien ventilado y revisado. Corrige primero agua, malezas y plantas enfermas.","FAO Crop Information - Sorghum"
"Sorgo","ph_suelo","alto","8.0","","advertencia","","Alcalinidad marcada: revisa nutrientes pequenos","El pH esta alto para el sorgo. Revisa hojas amarillas y ajusta la fertilizacion con base en analisis de suelo.","FAO Ecocrop - Sorghum"
"Soya","humedad","alto","75.0","","advertencia","","Humedad alta: mayor riesgo de roya asiatica","La humedad alta favorece enfermedades en la soya. Revisa hojas y mejora la ventilacion del cultivo.","FAO soybean rust review | AGROSAVIA"
"Soya","general","cualquiera","","","info","","Elimina plantas voluntarias y planta donde vive la plagas cercanos","Mantén la soya limpio, bien ventilado y revisado. Corrige primero agua, malezas y plantas enfermas.","AGROSAVIA - soybean rust management"
"Soya","general","cualquiera","","","info","","Mantén inoculacion y nodulacion bajo observacion","Mantén la soya limpio, bien ventilado y revisado. Corrige primero agua, malezas y plantas enfermas.","FAO Crop Information - Soybean"
"Soya","precipitacion","alto","1200.0","","advertencia","","Exceso de lluvia: vigila agua estancada y asfixia en raices","Hay demasiada lluvia para la soya. Limpia salidas de agua y revisa si aparecen pudriciones o manchas.","FAO Crop Information - Soybean"
"Maiz","humedad","muy_alto","85.0","","advertencia","","Humedad excesiva: vigila enfermedades en hojas","La humedad alta puede traer manchas en hojas y enfermedades. Revisa hojas medias y bajas, y evita que el cultivo quede demasiado cerrado.","FAO Crop Information - Maize"
"Maiz","general","cualquiera","","","info","","Floracion y llenado son fases de maxima sensibilidad","Revisa mas seguido durante floracion y llenado de grano. Si falta agua, hay plagas o aparecen enfermedades en esa etapa, la cosecha baja rapido.","CIMMYT maize management"
"Maiz","ph_suelo","alto","7.5","","advertencia","","PH alto: vigila zinc y hierro","El pH esta alto para el maiz. Revisa hojas amarillas y ajusta la fertilizacion con base en analisis de suelo.","FAO Crop Information - Maize"
"Frijol","temperatura","alto","25.0","","advertencia","","Temperatura elevada: vigila floracion y cuajado","El calor puede botar flores y bajar la cantidad de vainas. Mantén humedad pareja, quita malezas y revisa el cultivo en las horas frescas.","FAO Crop Information - Bean"
"Frijol","precipitacion","alto","1500.0","","advertencia","","Lluvia alta: aumenta presion de enfermedades","Demasiada lluvia aumenta pudriciones en frijol. Abre salidas de agua y evita entrar al lote cuando este mojado.","FAO Crop Information - Bean"
"Frijol","general","cualquiera","","","info","","Prioriza revision en floracion y llenado","Revisa mas seguido durante floracion y llenado de vaina. En esas etapas, falta de agua, calor o plagas bajan rapido la cosecha.","FAO Crop Information - Bean"
"Cafe","precipitacion","muy_alto","2500.0","","advertencia","","Lluvia excesiva: aumenta riesgo fitosanitario","Hay demasiada lluvia para el cafe. Limpia salidas de agua y revisa si aparecen pudriciones o manchas.","World Coffee Research | ANACAFE"
"Cafe","general","cualquiera","","","info","","Monitorea carga de fruto y nutricion despues de cosecha","Mantén el cafe limpio, bien ventilado y revisado. Corrige primero agua, malezas y plantas enfermas.","ANACAFE boletines tecnicos"
"Cafe","temperatura","alto","24.0","","advertencia","","Temperatura elevada: revisa broca y sombra","Hace mucho calor para el cafe. Riega temprano, conserva humedad en el suelo y revisa hojas marchitas o quemadas.","ANACAFE Manejo Integrado de Broca | World Coffee Research"
"Arroz","temperatura","alto","30.0","","advertencia","","Temperatura alta: vigila esterilidad en floracion","Hace mucho calor para el arroz. Riega temprano, conserva humedad en el suelo y revisa hojas marchitas o quemadas.","FAO rice handbook | IICA Guatemala"
"Arroz","general","cualquiera","","","info","","Maneja malezas y agua de forma integrada","Mantén el arroz limpio, bien ventilado y revisado. Corrige primero agua, malezas y plantas enfermas.","FAO Integrated crop and pest management in rice"
"Arroz","precipitacion","alto","120.0","","advertencia","","Lluvias altas: revisa acame y enfermedades","Hay mucha agua. Mantén el nivel controlado y evita que el agua se desborde o arrastre fertilizante y plantas pequeñas.","FAO rice handbook"
"Papa","humedad","alto","70.0","","advertencia","","Humedad alta: refuerza revision de tizones","La humedad alta favorece enfermedades en la papa. Revisa hojas y mejora la ventilacion del cultivo.","CIP late blight resources"
"Papa","general","cualquiera","","","info","","Usa semilla sana y evita repetir papa en el mismo lote","Mantén la papa limpio, bien ventilado y revisado. Corrige primero agua, malezas y plantas enfermas.","CIP production guidance"
"Papa","temperatura","alto","24.0","","advertencia","","Temperatura templada-alta: puede reducir calidad de tuberculo","Hace mucho calor para la papa. Riega temprano, conserva humedad en el suelo y revisa hojas marchitas o quemadas.","CIP heat stress resources"
"Tomate","humedad","alto","75.0","","advertencia","","Humedad alta: sube riesgo de tizones y manchas","La humedad alta favorece enfermedades en el tomate. Revisa hojas y mejora la ventilacion del cultivo.","UC IPM Tomato"
"Tomate","enfermedad","cualquiera","","","advertencia","","Vigila sintomas de TYLCV en hojas nuevas","Si ves manchas, pudricion o plantas marchitas en el tomate, retira partes muy enfermas y evita mover la enfermedad a plantas sanas.","UC IPM - Tomato Yellow Leaf Curl"
"Tomate","general","cualquiera","","","info","","La humedad uniforme baja pudricion apical","Mantén el tomate limpio, bien ventilado y revisado. Corrige primero agua, malezas y plantas enfermas.","UC IPM - Blossom end rot"
"Aguacate","general","cualquiera","","","info","","Evita acumulacion de agua cerca del cuello y raices","Mantén el aguacate limpio, bien ventilado y revisado. Corrige primero agua, malezas y plantas enfermas.","IICA avocado disease references"
"Aguacate","general","cualquiera","","","info","","La ventilacion de copa baja enfermedades de fruto","Mantén el aguacate limpio, bien ventilado y revisado. Corrige primero agua, malezas y plantas enfermas.","IICA Guatemala | avocado disease management"
"Aguacate","humedad","alto","75.0","","advertencia","","Humedad alta: incrementa presion de enfermedades","La humedad alta favorece enfermedades en el aguacate. Revisa hojas y mejora la ventilacion del cultivo.","IICA Guatemala | avocado disease management"
"Cacao","general","cualquiera","","","info","","Retira mazorcas enfermas y residuos del lote","Mantén el cacao limpio, bien ventilado y revisado. Corrige primero agua, malezas y plantas enfermas.","ICCO pests and diseases"
"Cacao","humedad","muy_alto","85.0","","advertencia","","Humedad extrema: sube la presion de monilia y mazorca negra","La humedad alta favorece enfermedades en el cacao. Revisa hojas y mejora la ventilacion del cultivo.","ICCO pests and diseases"
"Cacao","general","cualquiera","","","info","","La sombra debe ser regulada, no excesiva","Mantén el cacao limpio, bien ventilado y revisado. Corrige primero agua, malezas y plantas enfermas.","IICA / FAO cacao guidance"
"Zanahoria","temperatura","muy_bajo","","12.0","advertencia","","Frio: emergencia lenta y crecimiento reducido","El frio puede frenar el crecimiento de la zanahoria. Protege plantas pequeñas y evita dejar el suelo demasiado mojado.","FAO Ecocrop - Daucus carota"
"Zanahoria","temperatura","muy_alto","25.0","","advertencia","","Calor alto: baja calidad de raiz","Hace mucho calor para la zanahoria. Riega temprano, conserva humedad en el suelo y revisa hojas marchitas o quemadas.","FAO Ecocrop - Daucus carota"
"Zanahoria","precipitacion","muy_bajo","","35.0","advertencia","","Falta de agua: raices fibrosas y amargas","Falta lluvia para la zanahoria. Riega si puedes y cubre el suelo para conservar humedad.","UMN Extension - Growing carrots and parsnips"
"Zanahoria","humedad","muy_alto","80.0","","advertencia","","Humedad alta: vigila tizones en hojas","La humedad alta favorece enfermedades en la zanahoria. Revisa hojas y mejora la ventilacion del cultivo.","UMN Extension - Carrot leaf spots"
