cultivo,variable,condicion,umbral_min,umbral_max,nivel,icono,titulo,recomendacion,fuente
Banano,temperatura,alto,30.0,,advertencia,,Temperatura alta: aumenta demanda hidrica,"Cuando la temperatura se mantiene alta, el banano pierde agua con rapidez. Prioriza humedad uniforme del suelo, conserva cobertura organica y vigila marchitez en horas de la tarde.",FAO Crop Information - Banana
Banano,general,cualquiera,,,info,,Deshoje sanitario y ventilacion del lote,El deshoje sanitario oportuno y una densidad de siembra que permita ventilacion ayudan a disminuir la presion de Sigatoka negra y facilitan el monitoreo del cultivo.,FAO - Integrated management of Black Sigatoka
Sorgo,temperatura,alto,32.0,,info,,"Calor alto: el sorgo resiste, pero vigila floracion","El sorgo tolera calor mejor que otros cereales, pero durante floracion y llenado de grano el estres combinado con sequia puede reducir rendimiento. Vigila humedad del perfil y evita competencia de malezas.",FAO Crop Information - Sorghum | ICRISAT
Sorgo,plaga,cualquiera,,,advertencia,,Monitorea mosca del brote y barrenadores,"Revisa plantas con corazon muerto, tallos perforados o panojas deformadas. El monitoreo temprano permite eliminar focos y ajustar manejo integrado antes de que el dano se generalice.",ICRISAT Sorghum overview
Sorgo,general,cualquiera,,,info,,El sorgo responde bien a riego suplementario en secano,"Aunque es resistente a sequia, el sorgo puede responder favorablemente al riego suplementario en etapas criticas, especialmente si la lluvia es erratica y el cultivo entra en floracion con baja humedad del suelo.",FAO Crop Information - Sorghum
Sorgo,ph_suelo,alto,8.0,,advertencia,,Alcalinidad marcada: revisa micronutrientes,En suelos muy alcalinos puede disminuir la disponibilidad de algunos micronutrientes. Observa clorosis y ajusta fertilizacion con base en analisis de suelo.,FAO Ecocrop - Sorghum
Soya,humedad,alto,75.0,,advertencia,,Humedad alta: mayor riesgo de roya asiatica,Con humedad alta y follaje denso aumentan las condiciones para roya asiatica. Refuerza el monitoreo de hojas bajas y elimina plantas voluntarias o restos que mantengan inóculo en el lote.,FAO soybean rust review | AGROSAVIA
Soya,general,cualquiera,,,info,,Elimina plantas voluntarias y hospederos cercanos,"La eliminacion de soya voluntaria y hospederos alternos ayuda a reducir la permanencia de enfermedades entre ciclos, especialmente roya asiatica.",AGROSAVIA - soybean rust management
Soya,general,cualquiera,,,info,,Mantén inoculacion y nodulacion bajo observacion,Verifica nodulos activos en raices y evita acidez excesiva del suelo. Una nodulacion deficiente reduce el aprovechamiento biologico del nitrogeno y afecta el vigor del cultivo.,FAO Crop Information - Soybean
Soya,precipitacion,alto,1200.0,,advertencia,,Exceso de lluvia: vigila encharcamiento y asfixia radicular,Las lluvias intensas pueden reducir la aireacion de las raices y favorecer enfermedades. Mejora drenaje superficial y evita compactacion por maquinaria sobre suelo humedo.,FAO Crop Information - Soybean
Maiz,humedad,muy_alto,85.0,,advertencia,,Humedad excesiva: vigila enfermedades foliares,La humedad excesiva favorece manchas foliares y mayor persistencia de enfermedades. Mejora ventilacion con buen arreglo de plantas y evita labores cuando el follaje esta mojado.,FAO Crop Information - Maize
Maiz,general,cualquiera,,,info,,Floracion y llenado son fases de maxima sensibilidad,"Programa monitoreo mas frecuente de agua, plagas y enfermedades durante floracion y llenado de grano, porque el estres en estas etapas impacta directamente el rendimiento final.",CIMMYT maize management
Maiz,ph_suelo,alto,7.5,,advertencia,,Alcalinidad alta: vigila zinc y hierro,En suelos alcalinos pueden aparecer deficiencias de micronutrientes como zinc o hierro. Observa amarillamiento o crecimiento reducido y apoya la fertilizacion con base en analisis de suelo.,FAO Crop Information - Maize
Frijol,temperatura,alto,25.0,,advertencia,,Temperatura elevada: vigila floracion y cuajado,"A medida que sube la temperatura, el frijol puede sufrir aborto floral y menor amarre de vainas. Mantén humedad uniforme y reduce estres por maleza o compactacion.",FAO Crop Information - Bean
Frijol,precipitacion,alto,1500.0,,advertencia,,Lluvia alta: aumenta presion de enfermedades,Con lluvia alta y poco movimiento de aire aumenta el riesgo de antracnosis y otras enfermedades. Mejora drenaje y evita entrar al cultivo cuando el follaje esta mojado.,FAO Crop Information - Bean
Frijol,general,cualquiera,,,info,,Prioriza monitoreo en floracion y llenado,"En frijol, la falta de agua o calor excesivo durante floracion y llenado reduce rapidamente el rendimiento. Refuerza monitoreo en esas fases para corregir a tiempo.",FAO Crop Information - Bean
Cafe,precipitacion,muy_alto,2500.0,,advertencia,,Lluvia excesiva: aumenta riesgo fitosanitario,"La lluvia excesiva prolonga el mojado foliar y favorece roya, ojo de gallo y problemas de drenaje. Mantén sombra regulada, buen desagüe y poda de tejidos densos.",World Coffee Research | ANACAFE
Cafe,general,cualquiera,,,info,,Monitorea carga de fruto y nutricion despues de cosecha,"Despues de cosecha, la poda sanitaria y el ajuste nutricional ayudan a preparar el siguiente ciclo y a reducir el inoculo de enfermedades presentes en el lote.",ANACAFE boletines tecnicos
Cafe,temperatura,alto,24.0,,advertencia,,Temperatura elevada: revisa broca y sombra,"Temperaturas mas altas pueden favorecer broca y aumentar el estres del cafeto. Revisa frutos perforados, regula sombra y conserva humedad del suelo con cobertura organica.",ANACAFE Manejo Integrado de Broca | World Coffee Research
Arroz,temperatura,alto,30.0,,advertencia,,Temperatura alta: vigila esterilidad en floracion,Cuando el calor se intensifica alrededor de floracion aumenta el riesgo de esterilidad de espiguillas. Mantén manejo oportuno del agua y evita que el cultivo entre estresado a esa etapa.,FAO rice handbook | IICA Guatemala
Arroz,general,cualquiera,,,info,,Maneja malezas y agua de forma integrada,"El manejo integrado de arroz mejora cuando el control de malezas, el nivel de agua y la fertilizacion se coordinan. Evita agua estancada innecesaria en areas con problemas sanitarios recurrentes.",FAO Integrated crop and pest management in rice
Arroz,precipitacion,alto,120.0,,advertencia,,Lluvias altas: revisa acame y enfermedades,"Las lluvias abundantes pueden aumentar enfermedades y favorecer el acame. Revisa drenaje, sanidad del follaje y estabilidad del cultivo en etapas avanzadas.",FAO rice handbook
Papa,humedad,alto,70.0,,advertencia,,Humedad alta: refuerza vigilancia de tizones,"La humedad alta acelera infecciones foliares, especialmente si coincide con temperaturas frescas. Incrementa monitoreo y evita riegos que mantengan el follaje mojado por demasiado tiempo.",CIP late blight resources
Papa,general,cualquiera,,,info,,Usa semilla sana y evita repetir papa en el mismo lote,La semilla sana y la rotacion ayudan a reducir problemas de enfermedades de suelo y follaje. Evita establecer papa repetidamente en el mismo terreno sin descanso.,CIP production guidance
Papa,temperatura,alto,24.0,,advertencia,,Temperatura templada-alta: puede reducir calidad de tuberculo,"Incluso antes del calor extremo, temperaturas altas sostenidas pueden afectar tuberizacion y calidad. Conserva humedad del suelo y considera fechas de siembra mas frescas.",CIP heat stress resources
Tomate,humedad,alto,75.0,,advertencia,,Humedad alta: sube riesgo de tizones y manchas,"La humedad alta prolonga el mojado foliar y favorece enfermedades. Ventila bien el cultivo, poda hojas bajas y evita riegos por aspersion cuando no sean necesarios.",UC IPM Tomato
Tomate,enfermedad,cualquiera,,,advertencia,,Vigila sintomas de TYLCV en hojas nuevas,"Si observas amarillamiento, rizado, entrenudos cortos y caida de flores, sospecha de Tomato Yellow Leaf Curl Virus. Retira focos tempranos y refuerza control del vector.",UC IPM - Tomato Yellow Leaf Curl
Tomate,general,cualquiera,,,info,,La humedad uniforme reduce pudricion apical,Mantén humedad del suelo estable; los cambios bruscos entre sequia y exceso de agua aumentan la pudricion apical y reducen calidad de fruto.,UC IPM - Blossom end rot
Aguacate,general,cualquiera,,,info,,Evita acumulacion de agua cerca del cuello y raices,El aguacate es muy sensible a suelos mal drenados. Mantén el cuello del arbol libre de agua acumulada y evita compactacion en la zona de raices.,IICA avocado disease references
Aguacate,general,cualquiera,,,info,,La ventilacion de copa reduce enfermedades de fruto,Una copa aireada disminuye humedad interna y ayuda a reducir antracnosis y otras enfermedades. Realiza podas ligeras y elimina ramas cruzadas.,IICA Guatemala | avocado disease management
Aguacate,humedad,alto,75.0,,advertencia,,Humedad alta: incrementa presion de enfermedades,"En periodos humedos aumenta la necesidad de monitorear hojas, ramas y frutos para detectar antracnosis y otros problemas a tiempo. Prioriza ventilacion y sanidad del lote.",IICA Guatemala | avocado disease management
Cacao,general,cualquiera,,,info,,Retira mazorcas enfermas y residuos del lote,La remocion frecuente de mazorcas enfermas y residuos reduce el inóculo de monilia y mazorca negra. No dejes frutos enfermos en el suelo ni adheridos al arbol.,ICCO pests and diseases
Cacao,humedad,muy_alto,85.0,,advertencia,,Humedad extrema: sube la presion de monilia y mazorca negra,"Con humedad extrema y poca ventilacion, las enfermedades de fruto avanzan con rapidez. Mantén poda de sombra y cosecha frecuente para cortar el ciclo del patogeno.",ICCO pests and diseases
Cacao,general,cualquiera,,,info,,"La sombra debe ser regulada, no excesiva","El cacao necesita sombra, pero el exceso mantiene humedad alta y favorece enfermedades. Ajusta la cobertura para equilibrar proteccion y ventilacion.",IICA / FAO cacao guidance
