cultivo,variable,condicion,umbral_min,umbral_max,nivel,icono,titulo,recomendacion,fuente
Frijol,precipitacion,muy_bajo,,500.0,advertencia,,Déficit de lluvia en frijol,"Con lluvia anual por debajo de 500 mm, aumenta el riesgo de fallas en floración y llenado. Usa riego de apoyo cuando sea posible y conserva humedad con cobertura ligera.",https://ecocrop.apps.fao.org/ecocrop/srv/en/dataSheet?id=1668 | https://www.fao.org/land-water/databases-and-software/crop-information/bean/en/
Frijol,precipitacion,muy_alto,2000.0,,advertencia,,Lluvia excesiva: más presión de enfermedades,"Cuando la lluvia supera el rango óptimo, mejora el drenaje y la ventilación del cultivo. Evita labores con follaje mojado para no diseminar patógenos.",https://ecocrop.apps.fao.org/ecocrop/srv/en/dataSheet?id=1668 | https://www.fao.org/land-water/databases-and-software/crop-information/bean/en/
Frijol,ph_suelo,muy_bajo,,5.5,advertencia,,Acidez limita nodulación y absorción,"Bajo pH disminuye el ambiente favorable para Rhizobium y algunos nutrientes. Verifica pH del lote, corrige gradualmente la acidez y usa semilla inoculada cuando aplique.",https://ecocrop.apps.fao.org/ecocrop/srv/en/dataSheet?id=1668 | https://www.fao.org/land-water/databases-and-software/crop-information/bean/en/
Frijol,ph_suelo,alto,7.5,,advertencia,,Alcalinidad alta: vigila micronutrientes,"Si el pH pasa de 7.5, monitorea clorosis y crecimiento reducido. Ajusta nutrición con base en análisis y evita sobredosificar correctivos alcalinos.",https://ecocrop.apps.fao.org/ecocrop/srv/en/dataSheet?id=1668 | https://www.fao.org/land-water/databases-and-software/crop-information/bean/en/
Frijol,general,cualquiera,,,info,,Frijol responde mejor con buena aireación,Prefiere suelos bien drenados y ventilados. Mantén distancias de siembra que faciliten secado del follaje y reduce aspersiones tardías si la humedad ambiental ya es alta.,https://ecocrop.apps.fao.org/ecocrop/srv/en/dataSheet?id=1668 | https://www.fao.org/land-water/databases-and-software/crop-information/bean/en/
Frijol,general,cualquiera,,,info,,Momento crítico: floración y llenado,"En frijol, el estrés hídrico y térmico pesa más durante floración y llenado. Programa monitoreo más frecuente en esas fases y corrige problemas de agua con rapidez.",https://ecocrop.apps.fao.org/ecocrop/srv/en/dataSheet?id=1668 | https://www.fao.org/land-water/databases-and-software/crop-information/bean/en/
Arroz,temperatura,muy_bajo,,20.0,advertencia,,Temperatura baja para arroz,"El arroz se desempeña mejor en ambientes cálidos. Si la temperatura media baja de 20 °C, pueden retrasarse desarrollo y macollamiento; ajusta fecha de siembra y evita lotes fríos.",https://ecocrop.apps.fao.org/ecocrop/srv/en/dataSheet?id=1574 | https://www.fao.org/land-water/databases-and-software/crop-information/rice/en/
Arroz,temperatura,muy_alto,30.0,,advertencia,,Calor alto: vigila esterilidad floral,"Temperaturas por encima de 30 °C se salen del rango óptimo del arroz. Mantén manejo hídrico estable y monitorea la floración, etapa especialmente sensible al estrés térmico.",https://ecocrop.apps.fao.org/ecocrop/srv/en/dataSheet?id=1574 | https://www.fao.org/land-water/databases-and-software/crop-information/rice/en/
Arroz,precipitacion,muy_bajo,,1500.0,advertencia,,Lluvia baja para sistemas arroceros,"Si la lluvia anual cae por debajo de 1500 mm, el cultivo puede necesitar riego o manejo más estricto del agua. Revisa disponibilidad hídrica antes de ampliar área sembrada.",https://ecocrop.apps.fao.org/ecocrop/srv/en/dataSheet?id=1574 | https://www.fao.org/land-water/databases-and-software/crop-information/rice/en/
Arroz,precipitacion,muy_alto,2000.0,,advertencia,,Exceso hídrico: maneja lámina y escorrentía,"Aunque el arroz tolera saturación, lluvias muy altas pueden complicar manejo de malezas, fertilización y cosecha. Controla escorrentía y evita pérdidas de nutrientes.",https://ecocrop.apps.fao.org/ecocrop/srv/en/dataSheet?id=1574 | https://www.fao.org/land-water/databases-and-software/crop-information/rice/en/
Arroz,ph_suelo,muy_bajo,,5.5,advertencia,,Acidez fuera del rango óptimo,Bajo pH disminuye el ambiente óptimo del arroz y puede afectar disponibilidad de nutrientes. Verifica pH y corrige de forma planificada si el lote es muy ácido.,https://ecocrop.apps.fao.org/ecocrop/srv/en/dataSheet?id=1574 | https://www.fao.org/land-water/databases-and-software/crop-information/rice/en/
Arroz,ph_suelo,alto,7.0,,advertencia,,pH alto: revisar nutrición del arroz,"Si el pH supera 7.0, revisa síntomas de deficiencia y ajusta fertilización según análisis de suelo y agua.",https://ecocrop.apps.fao.org/ecocrop/srv/en/dataSheet?id=1574 | https://www.fao.org/land-water/databases-and-software/crop-information/rice/en/
Arroz,general,cualquiera,,,info,,El arroz tolera mal drenaje,"A diferencia de otros cultivos, el arroz puede producir bien en suelos pobres en drenaje. Aun así, mantén control de la lámina de agua para evitar pérdidas de fertilizante y problemas de cosecha.",https://ecocrop.apps.fao.org/ecocrop/srv/en/dataSheet?id=1574 | https://www.fao.org/land-water/databases-and-software/crop-information/rice/en/
Arroz,general,cualquiera,,,info,,Alta radiación mejora el potencial del cultivo,El arroz aprovecha bien ambientes luminosos. Minimiza sombreo y mantén nivelación del lote para uniformar agua y crecimiento.,https://ecocrop.apps.fao.org/ecocrop/srv/en/dataSheet?id=1574 | https://www.fao.org/land-water/databases-and-software/crop-information/rice/en/
Papa,temperatura,muy_bajo,,15.0,advertencia,,Ambiente frío: crecimiento lento de papa,"La papa tolera clima fresco, pero por debajo de 15 °C el desarrollo se hace más lento. Ajusta fecha de siembra y protege brotes jóvenes si hay riesgo de helada.",https://ecocrop.apps.fao.org/ecocrop/srv/en/dataSheet?id=1971 | https://www.fao.org/land-water/databases-and-software/crop-information/potato/en/
Papa,temperatura,muy_alto,25.0,,advertencia,,Calor: baja formación de tubérculos,"Por encima de 25 °C disminuye la condición óptima para tuberización. Usa mulch, riego oportuno y evita estrés hídrico en formación de tubérculos.",https://ecocrop.apps.fao.org/ecocrop/srv/en/dataSheet?id=1971 | https://www.fao.org/land-water/databases-and-software/crop-information/potato/en/
Papa,precipitacion,muy_bajo,,500.0,advertencia,,Lluvia baja: riesgo para tamaño de tubérculo,Con menos de 500 mm anuales se incrementa la necesidad de riego o de buena conservación de humedad. Mantén humedad uniforme para evitar deformaciones y rajaduras.,https://ecocrop.apps.fao.org/ecocrop/srv/en/dataSheet?id=1971 | https://www.fao.org/land-water/databases-and-software/crop-information/potato/en/
Papa,precipitacion,muy_alto,800.0,,advertencia,,Lluvia alta: aumenta riesgo sanitario,Arriba de 800 mm anuales la presión de enfermedades y problemas de pudrición suele aumentar. Refuerza drenaje y evita compactación en caballones.,https://ecocrop.apps.fao.org/ecocrop/srv/en/dataSheet?id=1971 | https://www.fao.org/land-water/databases-and-software/crop-information/potato/en/
Papa,ph_suelo,muy_bajo,,5.0,advertencia,,pH demasiado bajo para manejo estable,"La papa se adapta a suelos algo ácidos, pero por debajo de 5.0 conviene revisar aluminio y disponibilidad de nutrientes. Basa cualquier corrección en análisis de suelo.",https://ecocrop.apps.fao.org/ecocrop/srv/en/dataSheet?id=1971 | https://www.fao.org/land-water/databases-and-software/crop-information/potato/en/
Papa,ph_suelo,alto,6.2,,advertencia,,pH alto: fuera del rango óptimo de papa,"Si el pH supera 6.2, la papa sale del rango óptimo reportado por Ecocrop. Monitorea nutrición y ajusta manejo según análisis.",https://ecocrop.apps.fao.org/ecocrop/srv/en/dataSheet?id=1971 | https://www.fao.org/land-water/databases-and-software/crop-information/potato/en/
Papa,general,cualquiera,,,info,,La papa se adapta bien a zonas altas,"Es un cultivo apto para altitudes elevadas y climas frescos. En laderas, combina barreras de conservación y drenaje para evitar erosión y pérdida de suelo.",https://ecocrop.apps.fao.org/ecocrop/srv/en/dataSheet?id=1971 | https://www.fao.org/land-water/databases-and-software/crop-information/potato/en/
Papa,general,cualquiera,,,info,,Suelo suelto y drenado favorece tubérculos,"La formación de tubérculos mejora en suelos aireados y bien drenados. Evita compactación, prepara caballones firmes y no dejes agua estancada.",https://ecocrop.apps.fao.org/ecocrop/srv/en/dataSheet?id=1971 | https://www.fao.org/land-water/databases-and-software/crop-information/potato/en/
Tomate,temperatura,muy_bajo,,18.0,advertencia,,Temperatura baja: el tomate se enlentece,"El tomate crece mejor entre 18 y 25 °C. Si el ambiente está por debajo de 18 °C, protege plántulas y evita trasplantes en días fríos o ventosos.",https://www.fao.org/land-water/databases-and-software/crop-information/tomato/en/ | https://ecocrop.apps.fao.org/ecocrop/srv/en/cropView?id=9825
Tomate,temperatura,muy_alto,25.0,,advertencia,,Calor: floración y cuajado se vuelven inestables,"Arriba de 25 °C, sobre todo con alta humedad y viento, el rendimiento puede bajar. Procura humedad constante en suelo, sombra ligera temporal en vivero y buena ventilación.",https://www.fao.org/land-water/databases-and-software/crop-information/tomato/en/ | https://ecocrop.apps.fao.org/ecocrop/srv/en/cropView?id=9825
Tomate,precipitacion,muy_bajo,,1200.0,advertencia,,Lluvia baja: aumenta dependencia del riego,Con menos de 1200 mm anuales el cultivo suele depender más del riego para sostener crecimiento y fructificación. Programa riegos uniformes y evita ciclos de sequía-empape.,https://www.fao.org/land-water/databases-and-software/crop-information/tomato/en/ | https://ecocrop.apps.fao.org/ecocrop/srv/en/cropView?id=9825
Tomate,precipitacion,muy_alto,1600.0,,advertencia,,Lluvia alta: más problemas de rajado y enfermedad,"En ambientes muy lluviosos, mejora drenaje, tutorado y ventilación. Reduce mojado prolongado del follaje para bajar presión de enfermedades.",https://www.fao.org/land-water/databases-and-software/crop-information/tomato/en/ | https://ecocrop.apps.fao.org/ecocrop/srv/en/cropView?id=9825
Tomate,ph_suelo,muy_bajo,,5.0,advertencia,,Acidez alta: tomate sale del rango preferido,"FAO reporta preferencia por suelos de pH 5 a 7. Si el lote baja de 5.0, revisa acidez y disponibilidad de nutrientes antes de fertilizar más.",https://www.fao.org/land-water/databases-and-software/crop-information/tomato/en/ | https://ecocrop.apps.fao.org/ecocrop/srv/en/cropView?id=9825
Tomate,ph_suelo,alto,7.0,,advertencia,,pH alcalino: vigila clorosis y rendimiento,"Cuando el pH supera 7.0, monitorea micronutrientes y crecimiento. Ajusta fertilización con base en análisis, no por rutina.",https://www.fao.org/land-water/databases-and-software/crop-information/tomato/en/ | https://ecocrop.apps.fao.org/ecocrop/srv/en/cropView?id=9825
Tomate,general,cualquiera,,,info,,Evita el anegamiento en tomate,"FAO señala que el encharcamiento incrementa enfermedades como marchitez bacteriana. Mantén camas altas, drenaje funcional y riegos más frecuentes pero moderados.",https://www.fao.org/land-water/databases-and-software/crop-information/tomato/en/ | https://ecocrop.apps.fao.org/ecocrop/srv/en/cropView?id=9825
Tomate,general,cualquiera,,,info,,En trópico suele rendir mejor en altura media,"El tomate puede cultivarse desde nivel del mar hasta 2000 m en trópico, y FAO reporta que a menudo rinde mejor por encima de 1000 m. Ajusta variedad y fecha según altitud local.",https://www.fao.org/land-water/databases-and-software/crop-information/tomato/en/ | https://ecocrop.apps.fao.org/ecocrop/srv/en/cropView?id=9825
Aguacate,temperatura,muy_bajo,,15.0,advertencia,,Frío: crecimiento lento y más riesgo de daño,"El aguacate guatemalteco tiene rango óptimo cercano a 15-24 °C. Si el sitio cae por debajo de 15 °C de forma persistente, protege plantas jóvenes y evita podas fuertes antes de frentes fríos.",https://ecocrop.apps.fao.org/ecocrop/srv/en/dataSheet?id=17645 | https://ecocrop.apps.fao.org/ecocrop/srv/en/dataSheet?id=17646
Aguacate,temperatura,muy_alto,26.0,,advertencia,,Temperatura alta: mayor demanda de agua,"Cuando la temperatura supera el rango óptimo, el árbol demanda más agua y aumenta el riesgo de caída de flores o frutos pequeños. Refuerza mulch y monitorea humedad del suelo.",https://ecocrop.apps.fao.org/ecocrop/srv/en/dataSheet?id=17645 | https://ecocrop.apps.fao.org/ecocrop/srv/en/dataSheet?id=17646
Aguacate,precipitacion,muy_bajo,,1000.0,advertencia,,Lluvia insuficiente para aguacate,Por debajo de 1000 mm anuales el cultivo puede resentirse si no se compensa con riego. Prioriza riego profundo y espaciado en vez de riegos superficiales frecuentes.,https://ecocrop.apps.fao.org/ecocrop/srv/en/dataSheet?id=17645 | https://ecocrop.apps.fao.org/ecocrop/srv/en/dataSheet?id=17646
Aguacate,precipitacion,muy_alto,1400.0,,advertencia,,Exceso de lluvia: vigila asfixia radicular,"Lluvias muy por encima del rango óptimo aumentan riesgo de saturación y problemas de raíz. Mantén drenaje, evita compactación y no riegues si el perfil ya está húmedo.",https://ecocrop.apps.fao.org/ecocrop/srv/en/dataSheet?id=17645 | https://ecocrop.apps.fao.org/ecocrop/srv/en/dataSheet?id=17646
Aguacate,ph_suelo,muy_bajo,,5.0,advertencia,,pH muy ácido para aguacate,Con pH menor a 5.0 disminuye la calidad del ambiente radicular. Verifica acidez y corrige de forma gradual antes de establecer nuevas plantas.,https://ecocrop.apps.fao.org/ecocrop/srv/en/dataSheet?id=17645 | https://ecocrop.apps.fao.org/ecocrop/srv/en/dataSheet?id=17646
Aguacate,ph_suelo,alto,7.0,,advertencia,,pH alto: posible desbalance nutricional,"Si el pH rebasa 7.0, vigila deficiencias de micronutrientes y usa análisis de suelo y hoja para ajustar fertilización.",https://ecocrop.apps.fao.org/ecocrop/srv/en/dataSheet?id=17645 | https://ecocrop.apps.fao.org/ecocrop/srv/en/dataSheet?id=17646
Aguacate,general,cualquiera,,,info,,Aguacate necesita drenaje excelente,El cultivo responde mejor en suelos bien drenados. Nunca mantengas agua estancada cerca del cuello y favorece infiltración sin compactar el suelo.,https://ecocrop.apps.fao.org/ecocrop/srv/en/dataSheet?id=17645 | https://ecocrop.apps.fao.org/ecocrop/srv/en/dataSheet?id=17646
Aguacate,general,cualquiera,,,info,,La raza guatemalteca tolera mejor altitud media-alta,Los datos de Ecocrop reportan adaptación de la raza guatemalteca hasta unos 2400 m y de la raza antillana a zonas más bajas. Selecciona material vegetal acorde con tu altitud.,https://ecocrop.apps.fao.org/ecocrop/srv/en/dataSheet?id=17645 | https://ecocrop.apps.fao.org/ecocrop/srv/en/dataSheet?id=17646
Banano,temperatura,muy_bajo,,22.0,advertencia,,Temperatura fresca: se frena el banano,"El banano prefiere climas cálidos; FAO reporta un óptimo cercano a 27 °C y Ecocrop 22-32 °C. Si el ambiente baja de 22 °C de forma sostenida, el crecimiento se vuelve más lento.",https://ecocrop.apps.fao.org/ecocrop/srv/en/dataSheet?id=2483 | https://www.fao.org/land-water/databases-and-software/crop-information/banana/en/
Banano,temperatura,muy_alto,32.0,,advertencia,,Calor fuerte: sube la demanda de agua,"Con calor por arriba de 32 °C, el banano requiere vigilancia de humedad y protección frente a sequía y viento. Revisa riego y cobertura del suelo.",https://ecocrop.apps.fao.org/ecocrop/srv/en/dataSheet?id=2483 | https://www.fao.org/land-water/databases-and-software/crop-information/banana/en/
Banano,precipitacion,muy_bajo,,2000.0,advertencia,,Lluvia baja para banano,"FAO y Ecocrop coinciden en que el banano tiene alta demanda de agua. Por debajo de 2000 mm anuales bien distribuidos, evalúa riego suplementario.",https://ecocrop.apps.fao.org/ecocrop/srv/en/dataSheet?id=2483 | https://www.fao.org/land-water/databases-and-software/crop-information/banana/en/
Banano,precipitacion,muy_alto,2700.0,,advertencia,,Lluvia muy alta: más riesgo sanitario,"Si la lluvia supera el rango óptimo, mejora drenaje e infiltración y reduce acumulación de agua cerca de las plantas para bajar presión de enfermedades.",https://ecocrop.apps.fao.org/ecocrop/srv/en/dataSheet?id=2483 | https://www.fao.org/land-water/databases-and-software/crop-information/banana/en/
Banano,ph_suelo,muy_bajo,,5.0,advertencia,,Acidez alta en suelo bananero,"El rango óptimo reportado es aproximadamente 5.0-7.0. Si el pH cae por debajo de 5.0, revisa fertilidad y encalado con análisis previo.",https://ecocrop.apps.fao.org/ecocrop/srv/en/dataSheet?id=2483 | https://www.fao.org/land-water/databases-and-software/crop-information/banana/en/
Banano,ph_suelo,alto,7.0,,advertencia,,Suelo alcalino: vigila absorción de nutrientes,"Cuando el pH sube por encima de 7.0, monitorea deficiencias y evita aplicaciones que aumenten más la alcalinidad.",https://ecocrop.apps.fao.org/ecocrop/srv/en/dataSheet?id=2483 | https://www.fao.org/land-water/databases-and-software/crop-information/banana/en/
Banano,general,cualquiera,,,info,,Banano es sensible a viento y sequía,"Ecocrop señala susceptibilidad a viento y sequía. Refuerza cortinas rompeviento, cobertura del suelo y manejo del agua en épocas secas.",https://ecocrop.apps.fao.org/ecocrop/srv/en/dataSheet?id=2483 | https://www.fao.org/land-water/databases-and-software/crop-information/banana/en/
Banano,general,cualquiera,,,info,,Drenaje y materia orgánica son claves,"El banano necesita suelo profundo, fértil y bien drenado. Mejora estructura con residuos orgánicos y evita compactar alrededor de la planta.",https://ecocrop.apps.fao.org/ecocrop/srv/en/dataSheet?id=2483 | https://www.fao.org/land-water/databases-and-software/crop-information/banana/en/
Sorgo,temperatura,muy_bajo,,22.0,advertencia,,Temperatura baja para sorgo,El sorgo es de clima cálido; por debajo de 22 °C se aleja del rango óptimo. Ajusta siembra para evitar fases críticas en periodos frescos.,https://ecocrop.apps.fao.org/ecocrop/srv/en/dataSheet?id=48747 | https://www.fao.org/land-water/databases-and-software/crop-information/sorghum/en/
Sorgo,temperatura,muy_alto,35.0,,advertencia,,Calor extremo: vigila humedad del perfil,"Aunque el sorgo es resistente, temperaturas por encima de 35 °C pueden aumentar el estrés si falta agua. Conserva humedad y evita competencia de malezas.",https://ecocrop.apps.fao.org/ecocrop/srv/en/dataSheet?id=48747 | https://www.fao.org/land-water/databases-and-software/crop-information/sorghum/en/
Sorgo,precipitacion,muy_bajo,,400.0,advertencia,,Lluvia muy baja incluso para sorgo,"FAO lo describe como cultivo resistente a sequía, pero por debajo de 400 mm anuales el riesgo productivo sube. Considera variedades precoces o riego de apoyo.",https://ecocrop.apps.fao.org/ecocrop/srv/en/dataSheet?id=48747 | https://www.fao.org/land-water/databases-and-software/crop-information/sorghum/en/
Sorgo,precipitacion,muy_alto,600.0,,advertencia,,Lluvia alta: revisa sanidad y drenaje,"Cuando la lluvia supera el rango óptimo del sorgo, presta más atención a drenaje y enfermedades. Evita suelos con saturación prolongada.",https://ecocrop.apps.fao.org/ecocrop/srv/en/dataSheet?id=48747 | https://www.fao.org/land-water/databases-and-software/crop-information/sorghum/en/
Sorgo,ph_suelo,muy_bajo,,5.5,advertencia,,Acidez fuera del óptimo del sorgo,"Si el pH baja de 5.5, conviene revisar fertilidad y aluminio intercambiable antes de aumentar fertilización nitrogenada.",https://ecocrop.apps.fao.org/ecocrop/srv/en/dataSheet?id=48747 | https://www.fao.org/land-water/databases-and-software/crop-information/sorghum/en/
Sorgo,ph_suelo,alto,7.5,,advertencia,,Alcalinidad alta en sorgo,Por encima de 7.5 pueden presentarse limitaciones nutricionales. Ajusta manejo según análisis de suelo.,https://ecocrop.apps.fao.org/ecocrop/srv/en/dataSheet?id=48747 | https://www.fao.org/land-water/databases-and-software/crop-information/sorghum/en/
Sorgo,general,cualquiera,,,info,,Cultivo apto para ambientes secos,El sorgo destaca en zonas de lluvia baja o errática. Es una buena alternativa cuando el maíz de temporal tiene alto riesgo hídrico.,https://ecocrop.apps.fao.org/ecocrop/srv/en/dataSheet?id=48747 | https://www.fao.org/land-water/databases-and-software/crop-information/sorghum/en/
Sorgo,general,cualquiera,,,info,,Prefiere buen drenaje aun en secano,"Aunque tolera sequía, el sorgo no agradece saturación prolongada. Mantén estructura del suelo y salida de agua superficial.",https://ecocrop.apps.fao.org/ecocrop/srv/en/dataSheet?id=48747 | https://www.fao.org/land-water/databases-and-software/crop-information/sorghum/en/
Soya,temperatura,muy_bajo,,20.0,advertencia,,Temperatura baja: soya arranca lento,La soya es un cultivo de estación cálida. Por debajo de 20 °C el crecimiento inicial y la nodulación pueden hacerse más lentos.,https://ecocrop.apps.fao.org/ecocrop/srv/en/dataSheet?id=1150 | https://www.fao.org/land-water/databases-and-software/crop-information/soybean/en/
Soya,temperatura,muy_alto,33.0,,advertencia,,Calor alto: aumenta el estrés de la soya,Temperaturas superiores a 33 °C salen del rango óptimo reportado por Ecocrop. Mantén humedad suficiente en floración y llenado de grano.,https://ecocrop.apps.fao.org/ecocrop/srv/en/dataSheet?id=1150 | https://www.fao.org/land-water/databases-and-software/crop-information/soybean/en/
Soya,precipitacion,muy_bajo,,600.0,advertencia,,Lluvia baja: soya puede requerir apoyo,"Con menos de 600 mm anuales, la soya se vuelve más dependiente de distribución de lluvias o riego. Conserva humedad y controla malezas temprano.",https://ecocrop.apps.fao.org/ecocrop/srv/en/dataSheet?id=1150 | https://www.fao.org/land-water/databases-and-software/crop-information/soybean/en/
Soya,precipitacion,muy_alto,1500.0,,advertencia,,Lluvia excesiva: vigila aireación radicular,Por encima de 1500 mm aumenta el riesgo de suelos saturados y enfermedades. Prioriza drenaje y evita compactación.,https://ecocrop.apps.fao.org/ecocrop/srv/en/dataSheet?id=1150 | https://www.fao.org/land-water/databases-and-software/crop-information/soybean/en/
Soya,ph_suelo,muy_bajo,,5.5,advertencia,,Acidez limita el ambiente óptimo de la soya,"Si el pH baja de 5.5, revisa acidez y condiciones para nodulación. Corrige gradualmente con análisis previo.",https://ecocrop.apps.fao.org/ecocrop/srv/en/dataSheet?id=1150 | https://www.fao.org/land-water/databases-and-software/crop-information/soybean/en/
Soya,ph_suelo,alto,6.5,,advertencia,,pH alto: fuera del óptimo de la soya,"Ecocrop sitúa el óptimo cerca de 5.5-6.5. Si el pH supera 6.5, monitorea micronutrientes y ajusta fertilización con análisis.",https://ecocrop.apps.fao.org/ecocrop/srv/en/dataSheet?id=1150 | https://www.fao.org/land-water/databases-and-software/crop-information/soybean/en/
Soya,general,cualquiera,,,info,,La inoculación ayuda a aprovechar nitrógeno,"Al ser leguminosa, la soya se beneficia de buena nodulación. Usa semilla de calidad e inoculación apropiada cuando el historial del lote lo requiera.",https://ecocrop.apps.fao.org/ecocrop/srv/en/dataSheet?id=1150 | https://www.fao.org/land-water/databases-and-software/crop-information/soybean/en/
Soya,general,cualquiera,,,info,,Soya necesita buena luz y humedad estable,"La soya responde mejor con alta radiación y humedad del suelo relativamente estable, sobre todo en floración y llenado.",https://ecocrop.apps.fao.org/ecocrop/srv/en/dataSheet?id=1150 | https://www.fao.org/land-water/databases-and-software/crop-information/soybean/en/
Cafe,temperatura,muy_bajo,,18.0,advertencia,,Ambiente fresco para café arábica,"World Coffee Research reporta para arábica un rango óptimo medio anual cercano a 18-21 °C. Si el sitio es más frío, el crecimiento puede enlentecerse y subir el riesgo de daño por bajas temperaturas.",https://worldcoffeeresearch.org/news/2018/coping-with-32 | https://www.aboutcoffee.org/origins/coffee-regions-of-the-world/
Cafe,temperatura,muy_alto,24.0,,advertencia,,Calor sostenido reduce aptitud del café,"WCR indica que arábica pierde aptitud con ambientes más cálidos; mantén sombra regulada, cobertura y manejo del agua para amortiguar calor.",https://worldcoffeeresearch.org/news/2018/coping-with-32 | https://www.aboutcoffee.org/origins/coffee-regions-of-the-world/
Cafe,altitud,muy_bajo,,975.0,advertencia,,Altitud baja: más presión de calor en arábica,"La National Coffee Association ubica el arábica usualmente entre 3200 y 4900 pies. En zonas más bajas, monitorea calor, broca y calidad de taza con más atención.",https://worldcoffeeresearch.org/news/2018/coping-with-32 | https://www.aboutcoffee.org/origins/coffee-regions-of-the-world/
Cafe,general,cualquiera,,,info,,Sombra bien manejada ayuda a amortiguar estrés,"La sombra puede moderar temperatura y estrés hídrico, pero debe manejarse para no cerrar demasiado el dosel. Ajusta poda de sombra según humedad y ventilación del lote.",https://worldcoffeeresearch.org/news/2018/coping-with-32 | https://www.aboutcoffee.org/origins/coffee-regions-of-the-world/
Banano,humedad,muy_alto,85.0,,critica,,Sigatoka negra: condiciones muy favorables,"Con humedad muy alta y hojas mojadas por periodos prolongados aumenta el riesgo de Sigatoka negra. Retira hojas muy enfermas, mejora la aireacion del cultivo y evita exceso de sombra para reducir la humedad dentro de la plantacion.",FAO - Black Sigatoka management
Banano,precipitacion,alto,2400.0,,advertencia,,Lluvias persistentes: refuerza drenaje en banano,"Las lluvias persistentes elevan el riesgo de enfermedades foliares y problemas radiculares. Mantén canales limpios, evita acumulacion de agua alrededor del pseudotallo y revisa plantas con amarillamiento o crecimiento lento.",FAO Crop Information | FAO Black Sigatoka
